,Unnamed: 0,PARENT
3288,"Division of Kidney, Urologic, and Hematologic Diseases, National Institute of Diabetes and Digestive and Kidney Diseases, Bethesda, Maryland.",National Institutes of Health]US
3293,"The American Association of Kidney Patients, Tampa, Florida.",American Association of Kidney Patients]US
3294,"Department of Surgery and Perioperative Care, Dell Medical School, University of Texas at Austin, Austin, Texas.",University of Texas]US
3295,"Dell Medical School, The University of Texas at Austin, Austin, TX.",University of Texas]US
3298,"Department of Medicine, Division of Nephrology and Hypertension, Vanderbilt University Medical Center, Nashville, Tennessee.",Vanderbilt University]US
3303,"Division of Nephrology, School of Medicine, Indiana University, and Richard L. Roudebush Veteran Affairs Medical Center, Indianapolis, Indiana.",Indiana University]US
3306,"Department of Epidemiology and Biostatistics, Drexel University Dornsife School of Public Health, Philadelphia, PA.",Drexel University]US
3307,"Division of Nephrology & Hypertension, Mayo Clinic College of Medicine and Science, Rochester, Minnesota.",Mayo Clinic]US
3308,"Program in Transplantation, University of Maryland Medical Center, University of Maryland School of Medicine, Baltimore, MD.",University of Maryland]US
3311,"Perelman School of Medicine University of Pennsylvania, Philadelphia, Pennsylvania.",University of Pennsylvania]US
3312,"Division of Transplant Surgery, Medical College of Wisconsin, Milwaukee, Wisconsin, USA.",Medical College of Wisconsin]US
3321,"Division of Blood and Marrow Transplantation, Department of Pediatrics, Masonic Cancer Center, University of Minnesota, Minneapolis, Minnesota, USA.",University of Minnesota]US
3325,"Columbia Center for Translational Immunology, Columbia University Medical Center, New York City, New York City, USA.",Columbia University]US
3326,"Division of Endocrinology, Diabetes and Metabolism, Department of Medicine, Hospital of the University of Pennsylvania, Philadelphia, Philadelphia, USA.",University of Pennsylvania]US
3327,"Department of Surgery, University of Cincinnati College of Medicine, Cincinnati, Ohio, USA.",University of Cincinnati]US
3328,"Department of Medicine, Center for Precision Medicine and Genomics, Columbia University Vagelos College of Physicians and Surgeons, New York, NY.",Columbia University]US
3331,"Division of Nephrology and Kidney Research Institute, University of Washington, Seattle, Washington.",University of Washington]US
3332,"Section of Cardiology, Baylor College of Medicine, Houston, Texas.",Baylor College of Medicine]US
3336,"Division of Infectious Diseases and Global Public Health, University of California San Diego, La Jolla, CA.",University of California]US
3340,"UPMC Hepatic and Transplantation Pathology, Pittsburgh, Pennsylvania, USA.",University of Pittsburgh]US
3342,"Division of Nephrology, Department of Medicine, Johns Hopkins University, Baltimore, Maryland. Electronic address: chirag.parikh@jhmi.edu.",Johns Hopkins University]US
3343,"Department of Population Health, University of Illinois at Chicago, Illinois, USA.",University of Illinois]US
3346,"Nephrology Division, Massachusetts General Hospital, Boston, Massachusetts.",Harvard University]US
3348,"Vaccine and Infectious Disease Division, Fred Hutchinson Cancer Center, Seattle, Washington, USA",Fred Hutchinson]US
3349,"Nephrology, Department of Pediatrics, Weill-Cornell Medical Center, New York, New York.",Cornell University]US
3350,"Department of Surgery, University of Minnesota, Minneapolis, Minnesota, USA.",University of Minnesota]US
3351,"Welch Center for Prevention, Epidemiology, and Clinical Research, School of Medicine, Johns Hopkins University, Baltimore, Maryland.",Johns Hopkins University]US
3352,"Department of Epidemiology and Biostatistics, University of California-San Francisco, San Francisco, California.",University of California]US
3354,"Department of Surgery, Emory Transplant Center, Emory University School of Medicine, Atlanta, Georgia, USA.",Emory University]US
3356,"Biostatistics, Rho, Durham, North Carolina.",Rho]US
3363,"Center for Transplantation Sciences, Department of Surgery, Massachusetts General Hospital, Boston, Massachusetts, USA.",Harvard University]US
3365,"Department of Biostatistics, Epidemiology and Informatics, Center for Clinical Epidemiology and Biostatistics, Perelman School of Medicine, University of Pennsylvania, Philadelphia, Pennsylvania.",University of Pennsylvania]US
3368,"Division of Gastroenterology and Hepatology, Department of Medicine, Perelman School of Medicine, University of Pennsylvania, Philadelphia, PA.",University of Pennsylvania]US
3369,"Department of Medicine-Quantitative Health, University of Florida College of Medicine, Florida, USA.",University of Florida]US
3370,"Division of Nephrology, Department of Medicine, School of Medicine, Washington University in St. Louis, St. Louis, Missouri.",Washington University in St. Louis]US
3371,"Section of Nephrology, Hypertension, and Kidney Transplantation, Lewis Katz School of Medicine at Temple University, Philadelphia, Pennsylvania.",Temple University]US
3373,"Department of Family Medicine, Rowan-Virtua School of Osteopathic Medicine, Stratford, NJ.",Rowan University]US
3374,"Department of Surgery, University of Virginia, Charlottesville, Virginia, USA.",University of Virginia]US
3377,"Division of Geriatrics, Department of Medicine, University of Mississippi Medical Center, Jackson, Mississippi.",University of Mississippi]US
3378,"Providence Inland Northwest Health, University of Washington, Spokane, Washington.",Providence Health Inc]US
3380,"School of Medicine, University of Colorado Anschutz Medical Campus, Aurora, Colorado.",University of Colorado]US
3383,"Nephrology Division , Ohio State University Wexner Medical Center , Columbus, Ohio.",Ohio State University]US
3384,"Division of Infectious Diseases, University of Maryland Medical Center, Baltimore, MD.",University of Maryland]US
3387,"Department of Internal Medicine, Section on Nephrology, Wake Forest University School of Medicine, Winston-Salem, North Carolina.",Wake Forest University]US
3388,"Department of Medicine, University of Alabama at Birmingham, Birmingham, Alabama",University of Alabama]US
3391,"Nephrology Associates, PC, Birmingham, Alabama.",Nephrology Associates]US
3392,"University of Wisconsin School of Medicine and Public Health, University of Wisconsin, Madison, Wisconsin.",University of Wisconsin]US
3393,"Department of Transplant and Hepatobiliary Surgery, Henry Ford Health System, Detroit, Michigan, USA. Electronic address: snagai1@hfhs.org.",Henry Ford Health]US
3394,"Division of Nephrology, School of Medicine, Tulane University New Orleans, Louisiana.",Tulane University]US
3398,"University of Pittsburgh and VA Pittsburgh Health Care System, Pittsburgh, Pennsylvania.",University of Pittsburgh]US
3403,"Department of Epidemiology, University of North Carolina, Chapel Hill, North Carolina.",University of North Carolina]US
3410,"Evidence-Based Practice Center, Mayo Clinic, Rochester, Minnesota.",Mayo Clinic]US
3411,"Indiana University School of Medicine and VA Medical Center, Indianapolis, IN.",VA Health Systems Research]US
3412,"Division of Transplantation, Feinberg School of Medicine, Northwestern University, Chicago, Illinois.",Northwestern Univerisity]US
3413,"Department of Medicine, Jacobi Medical Center, Bronx, NY.",Montefiore]US
3419,"Division of Molecular Pathology and Genomics, University of Minnesota, Minneapolis, Minnesota.",University of Minnesota]US
3420,"Division of Nephrology, University of Texas Southwestern Medical Center, Dallas, Texas.",University of Texas]US
3421,"Department of Pathology and Laboratory Medicine, Cedars-Sinai Medical Center, Los Angeles, California.",University of California]US
3422,"National Institute of Diabetes, Digestive and Kidney Diseases, National Institutes of Health, Bethesda, Maryland.",National Institutes of Health]US
3423,"Division of Cardiothoracic Surgery, Department of Surgery, Washington University School of Medicine, St. Louis, Missouri, USA.",Washington University in St. Louis]US
3424,"Department of Pharmacy Practice, Lipscomb University College of Pharmacy, Nashville, Tennessee.",Lipscomb University]US
3425,"Department of Pediatrics, Children's Hospital of Philadelphia, Philadelphia, Pennsylvania",University of Pennsylvania]US
3426,"Division of Thoracic Surgery, Mayo Clinic, Rochester, MN.",Mayo Clinic]US
3427,"Department of Medicine, Johns Hopkins University School of Medicine, Baltimore, Maryland, USA",Johns Hopkins University]US
3429,"Divisions of Nephrology and Pulmonary, Critical Care, and Sleep Medicine, Department of Internal Medicine, University of New Mexico, Albuquerque, New Mexico.",University of New Mexico]US
3434,"Division of Nephrology, Columbia University Medical Center and the New York Presbyterian Hospital, New York, New York.",Columbia University]US
3435,"Department of Pulmonary Medicine, Cleveland Clinic, Cleveland, Ohio, USA. Electronic address: valapom@ccf.org.",Case Western Reserve University]US
3437,"Nephrology, Department of Medicine, University of Rochester Medical Center Rochester, New York, USA.",University of Rochester]US
3438,"Children's Hospital of Pennsylvania, Philadelphia, Pennsylvania.",University of Pennsylvania]US
3439,"Texas Institute for Measurement, Evaluation, and Statistics, University of Houston, Houston, Texas.",University of Houston]US
3442,"River City Pulmonology, Baptist Health System, San Antonio, Texas, USA",Tenet Health Inc]US
3443,"Division of Pediatric Nephrology, Boston Children's Hospital, Boston, MA, 2115, USA.",Harvard University]US
3444,"Center for Clinical Epidemiology and Biostatistics, Perelman School of Medicine, University of Pennsylvania, Philadelphia, PA.",University of Pennsylvania]US
3449,"Renal-Electrolyte and Hypertension Division, University of Pennsylvania Perelman School of Medicine, Philadelphia, Pennsylvania, USA",University of Pennsylvania]US
3450,"Children's of Alabama, Birmingham, Alabama, USA.",University of Alabama]US
3451,"Departments of Pediatrics and Pathology, Case Western Reserve University, Cleveland, OH.",Case Western Reserve University]US
3454,"School of Nursing, University of Northern Colorado, Greeley, Colorado, USA.",University of Northern Colorado]US
3457,"Johns Hopkins School of Nursing, Baltimore, Maryland, USA.",Johns Hopkins University]US
3459,"Laboratory of Applied Precision Omics (APO),National Heart,Lung and Blood Institute (NHLBI),National Institutes of Health,Bethesda,Maryland,USA",National Institutes of Health]US
3464,"Integris Baptist Medical Center, Transplant Division, Oklahoma City, Oklahoma, USA.",Integris Health Inc]US
3465,"Center for Individualized Medicine, Mayo Clinic, Rochester, MN.",Mayo Clinic]US
3469,"Section of Nephrology & Hypertension, LSU Health New Orleans School of Medicine, New Orleans, Louisiana.",Louisiana State University]US
3470,"Medical University of South Carolina, Charleston, South Carolina.",University of South Carolina]US
3473,"Division of Nephrology, VA New York Harbor Healthcare System, New York, New York.",VA Health Systems Research]US
3474,"Department of Medicine, Division of Nephrology, Tufts Medical Center, Boston, Massachusetts.",Tufts University]US
3478,"Department of Surgery, Stanford University School of Medicine, Palo Alto, California, USA.",Stanford University]US
3482,"Duke Clinical Research Institute, School of Medicine, Duke University, Durham, North Carolina.",Duke University]US
3483,"Children's Hospital of Pittsburgh of UPMC, Pittsburgh, Pennsylvania, USA",University of Pittsburgh]US
3484,"Department of Surgery, University of Iowa Carver College of Medicine, Iowa City, Iowa, USA.",University of Iowa]US
3487,"Division of Nephrology, Vanderbilt University Medical Center, Nashville, Tennessee.",Vanderbilt University]US
3489,"Division of Nephrology and Hypertension , Mayo Clinic , Rochester, Minnesota.",Mayo Clinic]US
3495,"Center for Clinical Epidemiology and Biostatistics, University of Pennsylvania, Philadelphia, Pennsylvania, USA. Electronic address: Vishnu.potluri@pennmedicine.upenn.edu.",University of Pennsylvania]US
3500,"VA San Diego Healthcare System and UC San Diego Health, La Jolla, California.",University of California]US
3501,"Section of Nephrology and Hypertension, Department of Medicine, Tulane University, New Orleans, Louisiana. Electronic address: falvarado@tulane.edu.",Tulane University]US
3503,"Division of Nephrology, Tulane University, New Orleans, Louisiana.",Tulane University]US
3506,"Division of Nephrology, Department of Internal Medicine, Allegheny General Hospital, Pittsburgh, Pennsylvania, USA.",Drexel University]US
3508,"Renal and Pancreas Transplant Division, Cooperman Barnabas Medical Center, Livingston, New Jersey, USA.",Rutgers University]US
3509,"Division of Nephrology, Department of Medicine, University of Michigan, Ann Arbor, MI.",University of Michigan]US
3510,"Department of Pediatrics, Cleveland Clinic Children's and Case Western Reserve University, Cleveland, Ohio.",Case Western Reserve University]US
3514,"Department of Medicine, University of Michigan School of Medicine, Ann Arbor, MI, USA.",University of Michigan]US
3515,"Department of Anesthesia, University of California San Diego, San Diego, California, USA.",University of California]US
3516,"Division of Gastroenterology and Hepatology, Department of Medicine, Perelman School of Medicine, University of Pennsylvania, Philadelphia, Pennsylvania, USA",University of Pennsylvania]US
3517,"Department of Epidemiology, Johns Hopkins Bloomberg School of Public Health, Baltimore, Maryland",Johns Hopkins University]US
3519,"Department of Kidney Medicine, Cleveland Clinic Foundation, Cleveland, Ohio.",Case Western Reserve University]US
3520,"Department of Emergency Medicine, Geriatric Research, Education and Clinical Center (GRECC), Vanderbilt University Medical Center and Veterans Affairs Tennessee Valley Healthcare System, Nashville, Tennessee.",Vanderbilt University]US
3522,"Department of Medicine, Division of Nephrology, Columbia University, New York, NY.",Columbia University]US
3530,"Stanford Immunology, Stanford University School of Medicine, Palo Alto, California, USA.",Stanford University]US
3531,"Department Medicine, Weill Cornell Medical College of Cornell University, New York, New York, USA.",Cornell University]US
3533,"Department of Laboratory Medicine and Pathology, Mayo Clinic, Rochester, Minnesota.",Mayo Clinic]US
3536,"Clinical and Translational Science Institute, University of Minnesota, Minneapolis, MN.",University of Minnesota]US
3537,"Nephrology Section, San Francisco VA Medical Center and Division of Nephrology, University of California, San Francisco, California.",VA Health Systems Research]US
3539,"Department of Pathology, Stanford University School of Medicine, Stanford, California, USA.",Stanford University]US
3540,"Cedars-Sinai Smidt Heart Institute, Los Angeles, California, USA.",University of California]US
3541,"Department of Obstetrics and Gynecology, Reproductive Endocrinology and Infertility, University Hospitals Cleveland Medical Center, Cleveland, OH.",Case Western Reserve University]US
3543,"Department of Pediatrics, Levine Children's Hospital at Atrium, Charlotte, North Carolina.",Wake Forest University]US
3544,"Department of Laboratory Medicine and Pathology, Mayo Clinic, Rochester, MN.",Mayo Clinic]US
3547,"Brigham and Women's Hospital, Harvard Medical School, Harvard T.H. Chan School of Public Health, Boston, Massachusetts.",Harvard University]US
3548,"Division of Nephrology, Children's National Hospital, Washington, DC.",George Washington University]US
3550,"W. Harry Feinstone Department of Molecular Microbiology and Immunology, Johns Hopkins Bloomberg School of Public Health, Baltimore, Maryland, USA.",Johns Hopkins University]US
3551,"Center for Transplantation Sciences, Department of Surgery, Massachusetts General Hospital/Harvard Medical School, Boston, Massachusetts, USA.",Harvard University]US
3552,"Department of Epidemiology and Biostatistics, University of California, San Francisco, California.",University of California]US
3555,"Clinical Pathology and Laboratory Medicine, Weill Cornell Medical College, New York, New York.",Cornell University]US
3556,New Mexico Department of Health.,New Mexico Department of Health]US
3560,"Federation Bio, South San Francisco, California.",Federation Bio Inc]US
3563,"Department of Nephrology and Hypertension, Weill Cornell Medical College, New York, New York.",Cornell University]US
3565,"Division of Nephrology, Department of Medicine, Massachusetts General Hospital, Harvard Medical Center, Boston, Massachusetts.",Harvard University]US
3567,"Department of Surgery, Division of Cardiothoracic Surgery, University of California San Diego, San Diego, California, USA.",University of California]US
3569,"Department of Medicine, Division of Nephrology, Massachusetts General Hospital and Harvard Medical School, Boston, Massachusetts.",Harvard University]US
3570,"Seattle Children's Research Institute, Seattle, Washington, USA",University of Washington]US
3573,"Department of Anesthesiology and Perioperative Medicine, University of Pittsburgh School of Medicine, Pittsburgh, PA.",University of Pittsburgh]US
3574,"Department of Medicine, University of Nebraska Medical Center, Omaha, Nebraska.",University of Nebraska]US
3575,"Department of Surgery, School of Medicine, University of Maryland, Baltimore, MD.",University of Maryland]US
3577,"Division of Transplant Surgery, Mayo Clinic Arizona, Phoenix, Arizona.",Mayo Clinic]US
3578,"Section of Health Services Research, Department of Medicine, Baylor College of Medicine, Houston, Texas",Baylor College of Medicine]US
3581,"Division of Biostatistics, School of Public Health, University of Minnesota, Minneapolis, MN.",University of Minnesota]US
3582,"Department of Gastroenterology and Nutrition, Geisinger, Danville, Pennsylvania",Geisinger Health]US
3583,"Care Delivery, Fresenius Kidney Care, Waltham, Massachusetts.",Fresenius Health]US
3584,"Department of Medicine, Duke University, Durham, North Carolina",Duke University]US
3585,"Department of Biomedical Engineering, SUNY Buffalo, Buffalo, New York.",State University of New York]US
3586,"Division of Nephrology and Hypertension, Department of Medicine, Vanderbilt University Medical Center, Nashville, Tennesse.",Vanderbilt University]US
3587,"Division of Nephrology and Hypertension, Loyola University Medical Center, Maywood, Illinois.",Loyola University]US
3588,"Section of Nephrology, Selzman Institute for Kidney Health, Baylor College of Medicine, Houston, Texas.",Baylor College of Medicine]US
3589,"Revivicor, Blacksburg, VA.",Revivicor Inc]US
3591,"Division of Nephrology, Department of Medicine, University of Illinois, Chicago, Illinois.",University of Illinois]US
3593,"Department of Biomedical Informatics, Cancer Center, Department of Pathology, Department of Pharmacological Sciences, Stony Brook University, Stony Brook, New York.",State University of New York]US
3594,"Immunogenetics/HLA laboratory Bloodworks Northwest, Seattle, Washington, USA.",Bloodworks Northwest]US
3595,"Baylor Scott & White Annette C. and Harold C. Simmons Transplant Institute, Baylor University Medical Center, Dallas, Texas, USA.",Baylor Scott & White Health]US
3596,"Department of Medicine, Emory University, Atlanta, Georgia, USA",Emory University]US
3598,"Division of Renal, Electrolyte, and Hypertension, Department of Medicine, University of Pennsylvania, Philadelphia, PA.",University of Pennsylvania]US
3600,"Division of Kidney Diseases and Hypertension, Department of Medicine, Donald and Barbara Zucker School of Medicine at Hofstra/Northwell, Great Neck, New York.",Northwell Health]US
3602,"Department of Surgery, Renal Transplant Division, Erie County Medical Center, Buffalo, New York, USA.",State University of New York]US
3604,"Chronic Disease Research Group, Hennepin Healthcare Research Institute, Minneapolis, Minnesota.",University of Minnesota]US
3605,"Medical Service, Veterans Affairs Health Care System, San Francisco, California, USA. Electronic address: Daniel.calabrese@ucsf.edu.",VA Health Systems Research]US
3606,"Selzman Institute for Kidney Health, Section of Nephrology, Baylor College of Medicine, Houston, Texas. Electronic address: carl.walther@bcm.edu.",Baylor College of Medicine]US
3611,"Division of General Internal Medicine, Brody School of Medicine, East Carolina University, Greenville, North Carolina.",East Carolina University]US
3612,"Division of Nephrology, Department of Medicine, Johns Hopkins University School of Medicine, Baltimore, Maryland. Electronic address: teresa.chen2@ucsf.edu.",Johns Hopkins University]US
3613,"Division of General, Geriatric, Palliative, and Hospital Medicine, University of Virginia School of Medicine, Charlottesville, Virginia.",University of Virginia]US
3614,"Organ Procurement and Transplantation Network, United Network for Organ Sharing, Richmond, VA.",United Network for Organ Sharing]US
3615,"Division of Pharmacotherapy and Experimental Therapeutics, UNC Eshelman School of Pharmacy, University of North Carolina at Chapel Hill, Chapel Hill, North Carolina",University of North Carolina]US
3619,"Center for Liver Disease and Transplantation, Columbia University, Vagelos College of Physicians and Surgeons, New York, New York, USA.",Columbia University]US
3620,"Department of Medicine, Maine Medical Center, Portland, ME.",Tufts University]US
3622,"Pediatrics, University of Washington School of Medicine, Seattle, Washington, USA.",University of Washington]US
3624,"Division of Nephrology, Columbia University, New York, New York, USA.",Columbia University]US
3626,"Chronic Kidney Disease Section, National Institute of Diabetes and Digestive and Kidney Diseases, National Institutes of Health, Phoenix, Arizona.",National Institutes of Health]US
3627,"Department of Urology, University of Alabama at Birmingham, Birmingham, Alabama.",University of Alabama]US
3628,"Quantitative Health Sciences, Mayo Clinic, Rochester, MN.",Mayo Clinic]US
3632,"Division of Nephrology and Hypertension, University Hospitals Cleveland Medical Center, Case Western Reserve University, Cleveland, Ohio.",Case Western Reserve University]US
3633,"National Institute of Allergy and Infectious Diseases, National Institutes of Health, Bethesda, Maryland, USA.",National Institutes of Health]US
3634,"Division of Transplant Surgery, Department of Surgery, Medical College of Wisconsin, Milwaukee, WI.",Medical College of Wisconsin]US
3635,"Department of Medicine (Nephrology), Stanford University, Stanford, California.",Stanford University]US
3638,"Department of Medicine, Emory University, Atlanta, Georgia.",Emory University]US
3639,"Office of Medical Education, University of Virginia School of Medicine, Charlottesville, Virginia.",University of Virginia]US
3641,"Department of Pathology, Atrium Health Wake Forest Baptist, Winston-Salem, North Carolina, USA.",University of North Carolina]US
3643,"Department of Pediatrics, Oregon Health and Science University, Portland, Oregon.",Oregon Health and Science University]US
3645,"Department of Surgery, University of Massachusetts Memorial Medical Center, Worcester, Massachusetts, USA.",University of Massachusetts]US
3651,"Department of Health and Human Physiology, The University of Iowa, Iowa City, Iowa.",University of Iowa]US
3652,"Division of Cardiology, Department of Medicine, Washington University School of Medicine, St. Louis, MO.",Washington University in St. Louis]US
3653,"Division of Pediatric Hematology/Oncology, Boston Children's Hospital, Boston, Massachusetts, USA",Harvard University]US
3654,"Division of Cardiovascular Medicine, Vanderbilt University Medical Center, Nashville, Tennessee, USA.",Vanderbilt University]US
3659,"Division of Rheumatology, Massachusetts General Hospital, Harvard Medical School, Boston, Massachusetts.",Harvard University]US
3661,"Robert D. and Patricia E. Kern Center for the Science of Health Care Delivery, Mayo Clinic, Rochester, MN.",Mayo Clinic]US
3664,"Otsuka Pharmaceutical Development & Commercialization, Inc, Rockville, Maryland.",Otsuka Inc]JP
3665,"Geriatrics Division, Department of Medicine, Hennepin HealthCare, and Berman Center for Outcomes and Clinical Research, Hennepin HealthCare Research Institute, Minneapolis, Minnesota",University of Minnesota]US
3667,"Population Health Sciences, University of Utah School of Medicine, Salt Lake City, Utah.",University of Utah]US
3673,"Renal Associates P.A., San Antonio, Texas.",Renal Associates P.A.]US
3675,"Tufts Medical Center, Boston, Massachusetts.",Tufts University]US
3677,"Roswell Park Comprehensive Cancer Center, Buffalo, New York, USA.",State University of New York]US
3678,"Department of Medicine, University of Wisconsin, Madison, Wisconsin, USA.",University of Wisconsin]US
3682,"Department of Surgery, Abdominal Transplantation, Stanford University, Palo Alto, CA.",Stanford University]US
3683,"Section of Nephrology , Baylor College of Medicine , Selzman Institute for Kidney Health , Houston , Texas.",Baylor College of Medicine]US
3685,"Vitaeris Inc (acquired by CSL Behring, King of Prussia, PA, USA), Vancouver, BC, Canada.",CSL Ltd]US
3686,"Geriatric Research and Education Clinical Center, VA Palo Alto Health Care System, Palo Alto, California.",VA Health Systems Research]US
3688,"The Rogosin Institute, Weill Cornell Medical College, New York, New York.",Cornell University]US
3689,"Metabolon, Morrisville, North Carolina.",Metabolon Inc]US
3690,"Baylor College of Medicine, Houston, Texas.",Baylor College of Medicine]US
3692,"Department of Psychiatry, Stanford University, Palo Alto, CA.",Stanford University]US
3694,"Division of Nephrology, Seattle Children's Hospital, Seattle, Washington.",University of Washington]US
