,Unnamed: 0,PARENT
2074,"Committee on Genetics, Genomics and Systems Biology, University of Chicago, Chicago, Illinois, USA.",University of Chicago]US
2075,"Department of Pediatrics, School of Medicine, Washington University, St. Louis, Missouri",Washington University in St. Louis]US
2079,"Utah Transplant Affiliated Hospitals (UTAH) Heart Transplant Network, Intermountain Central Laboratory, Salt Lake City, Utah, USA. Electronic address: dylan.miller@imail.org.",Intermountain Health Inc]US
2082,"Children's Hospital of Philadelphia, Philadelphia, Pennsylvania.",University of Pennsylvania]US
2086,"Division of Nephrology, Massachusetts General Hospital, Boston, Massachusetts.",Harvard University]US
2088,"Cardiology Section, Veterans Affairs San Diego Healthcare System, San Diego, CA.",VA Health Systems Research]US
2089,"Veloxis Pharmaceuticals, Cary, North Carolina, USA.",Veloxis Pharma Inc]DK
2090,"Brown Center for Evidence Synthesis in Health, Brown School of Public Health, Brown University, Providence, Rhode Island.",Providence Health Inc]US
2091,"Department of Health Policy, Stanford University, Stanford, California.",Stanford University]US
2093,"Division of Gastroenterology and Hepatology, Department of Medicine, University of California-San Francisco, San Francisco, CA.",University of California]US
2095,"Division of Pediatric Nephrology, Department of Pediatrics, Emory University School of Medicine and Children's Healthcare of Atlanta, Atlanta, Georgia.",Emory University]US
2097,"Eloxx Pharmaceuticals, Watertown, Massachusetts.",Eloxx Pharma Inc]US
2105,"Department of Medicine, Renal-Electrolyte Hypertension Division, Perelman School of Medicine, University of Pennsylvania, Philadelphia, Pennsylvania.",University of Pennsylvania]US
2106,"Division of General Internal Medicine, Department of Medicine, Mayo Clinic, Rochester, Minnesota, USA.",Mayo Clinic]US
2109,"Transplant Center, Department of Surgery, Massachusetts General Hospital, Boston, MA.",Harvard University]US
2110,"Center for Biomedical Informatics, Regenstrief Institute, Indianapolis, Indiana",Regenstrief]US
2111,"Department of Internal Medicine, Division of Nephrology, University of Pennsylvania, Philadelphia, Pennsylvania.",University of Pennsylvania]US
2114,"Division of Nephrology and Hypertension, University of Minnesota, Minneapolis, Minnesota.",University of Minnesota]US
2118,"Department of Medicine, Division of Cardiovascular Medicine, VA Palo Alto Health Care System, Palo Alto, California.",VA Health Systems Research]US
2120,"Division of Cardiothoracic Surgery, Department of Surgery, Washington University School of Medicine, St. Louis, Missouri, USA. Electronic address: varunpuri@wustl.edu.",Washington University in St. Louis]US
2121,"Department of Inflammation and Immunity, Lerner Research Institute, Cleveland Clinic, Cleveland, OH.",Case Western Reserve University]US
2123,"Division of Nephrology, Department of Medicine, The Johns Hopkins University School of Medicine, Baltimore, Maryland.",Johns Hopkins University]US
2126,"Pediatric Critical Care and Liver ICU, Baylor College of Medicine, Texas Children's Hospital, Houston, Texas, USA.",Baylor College of Medicine]US
2131,"Division of Transplantation, Department of Surgery, UWHealth Transplant Center, University of Wisconsin School of Medicine and Public Health, Madison, Wisconsin, USA.",University of Wisconsin]US
2133,"Stanford University Medical Center , Stanford, California.",Stanford University]US
2134,"Division of Pulmonary, Allergy and Critical Care, Department of Medicine, Duke University Medical Center, Durham, North Carolina.",Duke University]US
2135,"Division of Cardiac Surgery,Department of Surgery,The Ohio State University Wexner Medical Center,Columbus,Ohio,USA.",Ohio State University]US
2136,"Tufts Clinical and Translational Science Institute, Tufts University, Boston, MA",Tufts University]US
2139,"Division of Kidney Diseases and Hypertension, George Washington University, Washington, DC.",George Washington University]US
2141,"Department of Population Health Sciences, Duke University, Duke University, Durham, NC, USA. Electronic address: lisa.mcelroy@duke.edu.",Duke University]US
2142,"Welch Center for Prevention, Epidemiology and Clinical Research, Johns Hopkins University Baltimore, Maryland",Johns Hopkins University]US
2143,"Departments of Surgery and Epidemiology, University of Colorado Anschutz Medical College, Aurora, Colorado.",University of Colorado]US
2145,"Center for the Study of Aging and Human Development (the Aging Center), Duke University, Durham, North Carolina",Duke University]US
2148,"Division of Nephrology, Baylor College of Medicine, Houston, Texas.",Baylor College of Medicine]US
2149,"Department of Medicine, Division of Cardiology, Columbia University Irving Medical Center.",Columbia University]US
2150,"Kidney Health Research Collaborative, Department of Medicine, San Francisco VA Health Care System and University of California, San Francisco, California.",VA Health Systems Research]US
2151,"Renal Research Institute, New York and Institute of Molecular Biology and Genetics (Biogem), Ariano Irpino, Italy.",Renal Research Institute]US
2153,"Kaiser Permanente Center for Health Research, Portland, Oregon.",Kaiser Permanente]US
2157,"Division of Cardiology, Duke University School of Medicine, Durham, North Carolina, USA.",Duke University]US
2160,"Department of Radiology, Mayo Clinic, Rochester, Minnesota. Electronic address: amurray@bermancenter.org.",Mayo Clinic]US
2165,"Duke Center for Antimicrobial Stewardship and Infection Prevention, Durham, North Carolina, USA.",Duke University]US
2166,"Department of Public Health & Community Medicine, School of Medicine, Tufts University, Boston.",Tufts University]US
2168,"Columbia Center for Translational Immunology, Columbia University Medical Center, Department of Medicine, Department of Surgery, Department of Microbiology & Immunology, Columbia University, New York, NY.",Columbia University]US
2170,"Division of Healthcare Delivery Science & Innovation and Division of Nephrology & Hypertension, Weill Cornell Medicine, New York, New York.",Cornell University]US
2171,"Pediatric Nephrology Department, University of Alabama, Birmingham, Alabama, USA.",University of Alabama]US
2172,"University of Texas Health, San Antonio, Texas, USA.",University of Texas]US
2175,"Division of Nephrology, School of Medicine, Duke University, Durham, North Carolina.",Duke University]US
2176,"Department of Surgery, University of Illinois-Chicago, Chicago, Illinois, USA.",University of Illinois]US
2177,"Division of Nephrology, Department of Medicine, Columbia University College of Physicians and Surgeons, New York, New York.",Columbia University]US
2180,"Department of Pharmacy Practice and Science, University of Kentucky College of Pharmacy, Lexington, Kentucky.",University of Kentucky]US
2182,"Medstar Georgetown Transplant Institute, Washington, District of Columbia, USA.",Georgetown University]US
2184,"Transplant Nephrology, UPMC Pinnacle, Harrisburg, Pennsylvania.",University of Pittsburgh]US
2187,"St. Louis Children's Hospital, St. Louis, Missouri.",Washington University in St. Louis]US
2190,"Department of Laboratory Medicine and Pathology, University of Minnesota Medical School, Minneapolis, Minnesota.",University of Minnesota]US
2194,"Mid-America Transplant, St. Louis, Missouri, USA.",Mid-America Transplant]US
2200,"Department of Medicine, Division of Nephrology, Columbia University, New York, New York.",Columbia University]US
2203,"Department of Surgery, Colorado Center for Transplantation Care, Research, and Education (CCTCARE), University of Colorado Anschutz Medical Campus, Aurora, CO.",University of Colorado]US
2205,"Department of Surgery, University of Chicago, Chicago, Illinois, USA.",University of Chicago]US
2210,"Section of Nephrology, Department of Internal Medicine, Mount Sinai School of Medicine, New York, New York.",Mount Sinai]US
2211,"California Emerging Infections Program, Oakland, California",California Emerging Infections Program]US
2217,"Welch Center for Prevention, Epidemiology, and Clinical Research, School of Medicine, Johns Hopkins University, Baltimore, Maryland. Electronic address: jishiga1@jhu.edu.",Johns Hopkins University]US
2218,"Department of Biostatistics, University of North Carolina, Chapel Hill, North Carolina.",University of North Carolina]US
2219,"San Francisco VA Health Care System, San Francisco, California.",VA Health Systems Research]US
2222,"Division of Transplant Surgery, Department of Surgery, Brigham and Women's Hospital, Harvard Medical School, Boston, Massachusetts, USA",Harvard University]US
2223,"Division of Abdominal Transplantation and Hepatobiliary Surgery, Department of Surgery, Baylor College of Medicine, Houston, Texas, USA.",Baylor College of Medicine]US
2226,"Department of Pediatrics, UPMC Children's Hospital of Pittsburgh, Pittsburgh, PA.",University of Pittsburgh]US
2227,"Kidney Health Research Collaborative, San Francisco Veterans Affair Medical Center and University of California, San Francisco, California.",VA Health Systems Research]US
2229,"Louisiana State University Health Sciences Center, New Orleans, Louisiana.",Louisiana State University]US
2230,"UC San Diego Health, San Diego, CA.",University of California]US
2231,"Division of Nephrology, Department of Medicine, School of Medicine, Johns Hopkins University, Baltimore, Maryland. Electronic address: chirag.parikh@jhmi.edu.",Johns Hopkins University]US
2232,"Department of Anesthesiology, Thomas Jefferson University Hospital, Philadelphia, PA.",Thomas Jefferson University]US
2234,"Division of Public Health, Infectious Diseases, and Occupational Medicine, Mayo Clinic, Rochester, Minnesota, USA.",Mayo Clinic]US
2235,"Transplantation Center, Digestive Disease and Surgery Institute, Cleveland Clinic, Cleveland, OH.",Case Western Reserve University]US
2236,"Division of Nephrology, Northwestern University, Chicago, Illinois.",Northwestern Univerisity]US
2239,"Providence St Joseph Heritage Medical Group, Renal Services, Orange, California.",Providence Health Inc]US
2241,"Department of Clinical Genomics, Mayo Clinic, Rochester, Minnesota.",Mayo Clinic]US
2242,"Renal Division, Transplantation Research Center, Brigham and Women's Hospital and Children's Hospital, Harvard Medical School, Boston, Massachusetts.",Harvard University]US
2243,"Molecular Pathogenesis Program, The Kimmel Center for Biology and Medicine of the Skirball Institute, New York University School of Medicine, New York, USA",New York University]US
2244,"Tufts Medical Center, and Tufts Clinical and Translational Science Institute, Tufts University, Boston, Massachusetts.",Tufts University]US
2246,"Division of Renal Pathology, Department of Pathology and Laboratory Medicine, Weill Cornell Medicine, Cornell University, New York, New York, USA.",Cornell University]US
2247,"Center for Health Services Research, Regenstrief Institute, Indianapolis, Indiana.",Regenstrief]US
2248,"Department of Medicine, Transplant Pulmonology, Duke University School of Medicine, Durham, North Carolina, USA.",Duke University]US
2249,"Loma Linda University Children's Hospital, Loma Linda, California.",Loma Linda University]US
2254,"Icahn School of Medicine at Mount Sinai, New York, New York.",Mount Sinai]US
2259,"Division of Gastroenterology/Hepatology, Mayo Clinic, Rochester, MN.",Mayo Clinic]US
2260,"Department of Medicine, University of Miami Miller School of Medicine, Miami, FL.",University of Miami]US
2261,"Division of Nephrology, Department of Medicine, School of Medicine, Washington University in St. Louis, St. Louis, Missouri",Washington University in St. Louis]US
2262,"Division of Renal, Perelman School of Medicine at the University of Pennsylvania, Philadelphia, Pennsylvania, USA.",University of Pennsylvania]US
2263,"Research and Development, Transplant Therapeutic Area, CSL Behring, King of Prussia, Pennsylvania, PA.",CSL Ltd]US
2264,"Solid Organ Transplant Center, Department of Surgery, University of Iowa, Iowa City, Iowa, USA.",University of Iowa]US
2267,"Division of Nephrology and Hypertension, University Hospitals Cleveland Medical Center, Cleveland, Ohio.",Case Western Reserve University]US
2273,"Department of Medicine, Veterans Affairs Central California Health Care System, Fresno, California.",VA Health Systems Research]US
2274,"Departments of Medicine and Surgery, Yale University, New Haven, Connecticut.",Yale University]US
2276,"University of California San Diego and VA San Diego Health Care System, San Diego, California.",University of California]US
2280,"Division of Surgical Transplantation,Department of Surgery,University of Texas Southwestern Medical Center,Dallas,Texas,USA.",University of Texas]US
2282,"Janssen Research & Development, LLC, Spring House, Pennsylvania.",Johnson & Johnson Inc]US
2287,"Division of Nephrology, Department of Medicine, Vagelos College of Physicians and Surgeons, Columbia University, New York, New York.",Columbia University]US
2289,"Department of Population and Quantitative Health Sciences, Case Western Reserve University and Louis Stoke, Cleveland, Ohio.",Case Western Reserve University]US
2293,"Department of Medicine, Duke University School of Medicine, Durham, North Carolina.",Duke University]US
2294,"Division of Cardiovascular Medicine, Department of Medicine, Washington University in St. Louis, Missouri, USA.",Washington University in St. Louis]US
2297,"Department of Surgery and Emory Transplant Center, Suite 5105, 101 Woodruff Circle, Atlanta, Georgia 30322.",Emory University]US
2298,"Division of Nephrology, University of Alabama at Birmingham, Birmingham, Alabama.",University of Alabama]US
2299,"Division of Gastroenterology, Hepatology, and Nutrition, Department of Pediatrics, Baylor College of Medicine, Texas Children's Hospital, Houston, Texas, USA.",Baylor College of Medicine]US
2302,"Cerevel Therapeutics, Cambridge, Massachusetts.",Cerevel Inc]US
2305,"Inflammation and Immunology Research Unit, Pfizer Inc., Cambridge, Massachusetts.",Pfizer Inc]US
2309,"Division of Transplant Surgery, University of Alabama at Birmingham, Birmingham, Alabama.",University of Alabama]US
2310,"Section of Nephrology, Department of Internal Medicine, Yale School of Medicine, New Haven, Connecticut.",Yale University]US
2312,"Division of Cardiovascular and Thoracic Surgery, Duke University School of Medicine, Durham, North Carolina, USA.",Duke University]US
2313,"Clinical Research Division, Fred Hutchinson Cancer Center, Seattle, Washington, USA.",Fred Hutchinson]US
2314,"University of Kentucky, Lexington, Kentucky.",University of Kentucky]US
2317,"Section on Nephrology, Wake Forest University School of Medicine, Winston-Salem, North Carolina.",Wake Forest University]US
2318,"Mount Sinai Heart, Icahn School of Medicine at Mount Sinai Health System, New York, NY.",Mount Sinai]US
2320,"Department of Pathology, Brigham and Women's Hospital, Boston, Massachusetts, USA",Harvard University]US
2322,"Division of General Internal Medicine, Johns Hopkins University School of Medicine, Baltimore, Maryland.",Johns Hopkins University]US
2323,"Department of Public Health Sciences, Henry Ford Health System, Detroit, Michigan, USA.",Henry Ford Health]US
2330,"Division of Pediatric Nephrology, University of New Mexico Children's Hospital, Albuquerque, New Mexico.",University of New Mexico]US
2331,"Division of Metabolism, Endocrinology, and Nutrition, Department of Medicine, University of Washington, Seattle, Washington.",University of Washington]US
2332,"Department of Medicine, Division of Gastroenterology, Hepatology and Nutrition, Vanderbilt University Medical Center, Nashville, TN.",Vanderbilt University]US
2334,"Department of Clinical Genomics, Mayo Clinic, Rochester, MN.",Mayo Clinic]US
2336,"Columbia University Vagelos College of Physicians and Surgeons, Institute for Genomic Medicine, New York, NY.",Columbia University]US
2337,"City University of New York School of Medicine, New York, New York.",City University]US
2338,"Beth Israel Deaconess Medical Center, Boston, Massachusetts.",Tufts University]US
2340,"Tufts Medical Center, and School of Medicine, Tufts University, Boston, Massachusetts.",Tufts University]US
2343,"Ascension St Vincent Heart Center, Indianapolis, Indianapolis, Indiana, USA.",Ascension Health Inc]US
2347,"Department of Medicine, University of North Carolina at Chapel Hill, Chapel Hill, North Carolina, USA",University of North Carolina]US
2348,"William J. von Liebig Center for Transplantation and Clinical Regeneration, Mayo Clinic, Rochester, MN.",Mayo Clinic]US
2354,"Division of Gastroenterology and Hepatology, Perelman School of Medicine, University of Pennsylvania, Philadelphia, PA.",University of Pennsylvania]US
2359,"Division of Nephrology, Boston, Massachusetts.",
2362,"Stanford Hypertension Center and Division of Nephrology, Department of Medicine, School of Medicine, Stanford University, Stanford, California.",Stanford University]US
2365,"University of Miami School of Medicine, Miami, Florida.",University of Miami]US
2368,"School of Medicine, University of Washington, and Providence Health Care, Spokane, Washington.",Providence Health Inc]US
2371,"Division of Nephrology, Department of Medicine, School of Medicine, Johns Hopkins University, Baltimore, Maryland. Electronic address: crebhol1@jhu.edu.",Johns Hopkins University]US
2372,"University of Pittsburgh, Pittsburgh, Pennsylvania.",University of Pittsburgh]US
2375,"Department of Internal Medicine, Division of Nephrology, University of Texas Southwestern Medical Center, Dallas, TX.",University of Texas]US
2381,"Department of Biostatistics and Bioinformatics, School of Medicine, Duke University, Durham, North Carolina.",Duke University]US
2386,"Department of Medicine and Department of Public Health Sciences, School of Medicine, University of Virginia, Charlottesville, Virginia.",University of Virginia]US
2387,"Transplant Institute, Keck Medical Center of USC, Los Angeles, California, USA.",University of Southern California]US
2392,"Division of Cardiology and Nephrology, Center for Drug Evaluation and Research, Food and Drug Administration, Silver Spring, Maryland.",Department of Health and Human Services]US
2394,"Division of Reproductive Endocrinology and Infertility, Mayo Clinic, Rochester, Minnesota.",Mayo Clinic]US
2396,"Kidney Transplant Program, Montefiore Medical Center, Albert Einstein College of Medicine, Bronx, NY.",Albert Einstein College of Medicine]US
2398,"Vanderbilt Institute for Clinical and Translational Research, Vanderbilt University Medical Center, Nashville, Tennessee.",Vanderbilt University]US
2404,"Johns Hopkins All Children's Heart Institute, Johns Hopkins All Children's Hospital, St. Petersburg, FL.",Johns Hopkins University]US
2406,"Weill Cornell Medicine - New York Presbyterian Hospital, New York, New York, USA. Electronic address: dls7001@med.cornell.edu.",Cornell University]US
2408,"Division of Nephrology, School of Medicine, University of Maryland, Baltimore, Maryland.",University of Maryland]US
2410,"Division of Nephrology, Department of Medicine, Department of Epidemiology, Johns Hopkins Bloomberg School of Public Health, Johns Hopkins University School of Medicine, Baltimore, Maryland.",Johns Hopkins University]US
2411,"Department of Psychiatry & Psychology, Mayo Clinic, Scottsdale, AZ.",Mayo Clinic]US
2415,"Department of Health Policy and Management, Rollins School of Public Health, Emory University Atlanta, Georgia.",Emory University]US
2416,"Division of Biostatistics, Department of Population Health Sciences, University of Utah Health, Salt Lake City, Utah.",University of Utah]US
2417,"Translational Transplant Research Center, Icahn School of Medicine at Mount Sinai, New York, New York, USA.",Mount Sinai]US
2419,"Department of Medicine, Tufts Medical Center, Boston, Massachusetts.",Tufts University]US
2420,"Department of Internal Medicine, Division of Nephrology, Bone and Mineral Metabolism, University of Kentucky, Lexington, KY",University of Kentucky]US
2424,"Division of Nephrology, University of California San Francisco, San Francisco, California",University of California]US
2425,"Department of Pediatrics, Children's Mercy Kansas City, Kansas City, Missouri.",University of Kansas]US
2429,"Division of Transplantation, Department of Surgery, UW Health Transplant Center, University of Wisconsin School of Medicine and Public Health, Madison, Wisconsin, USA.",University of Wisconsin]US
2432,"Department of Medicine, University of Alabama at Birmingham Heersink School of Medicine, Birmingham, AL.",Univeristy of Alabama]US
2440,"Division of Data Driven and Digital Medicine, Icahn School of Medicine at Mount Sinai, New York, New York",Mount Sinai]US
2442,"Division of Nephrology & Hypertension, Northshore University Health System-University of Chicago, Evanston, Illinois.",University of Chicago]US
2444,"Department of Medicine, Renal Division, Emory University School of Medicine, Atlanta, Georgia.",Emory University]US
2445,"Boston University School of Medicine, Boston, Massachusetts.",Boston University]US
2446,"Center for Clinical Epidemiology and Biostatistics, University of Pennsylvania Perelman School of Medicine, Philadelphia, Pennsylvania, USA.",University of Pennsylvania]US
2447,"Department of Pediatric Nephrology, Duke Children's Hospital and Health Center, Durham, North Carolina.",Duke University]US
2448,"Division of Nephrology, Department of Medicine, Icahn School of Medicine at Mount Sinai, New York, New York. Electronic address: steven.coca@mssm.edu.",Mount Sinai]US
2449,"Department of Abdominal Transplantation, Annette C. and Harold C. Simmons Transplant Institute, Baylor University Medical Center, Dallas, TX.",Baylor University]US
2454,"Chronic Kidney Disease Section, National Institute of Diabetes and Digestive and Kidney Diseases, Phoenix, Arizona.",National Institutes of Health]US
2455,"Department of Internal Medicine, Division of Infectious Diseases, University of Utah Spencer Fox Eccles School of Medicine, Salt Lake City, Utah.",University of Utah]US
2457,"Baylor Scott and White Research Institute, Dallas, Texas.",Baylor Scott & White Health]US
2458,"Michael E. DeBakey VA Medical Center Health Services Research and Development , Center for Innovations in Quality, Effectiveness and Safety , Houston , Texas.",VA Health Systems Research]US
2459,"Department of Nephrology, AZ Delta, Roeselare, Belgium.",AZ Delta ]BE
2461,"Division of Pulmonary and Critical Care, Department of Medicine, Mayo Clinic, Rochester, Minnesota.",Mayo Clinic]US
2463,"Pediatrics, University of Washington School of Medicine, Seattle, Washington, USA. Electronic address: shaun.jackson@seattlechildrens.org.",University of Washington]US
2464,"Thomas E. Starzl Transplantation Institute, University of Pittsburgh, Pittsburgh, PA.",University of Pittsburgh]US
2467,"Department of Surgery, Columbia University Medical Center, New York, NY.",Columbia University]US
2468,"Divisions of Nephrology, Department of Medicine, University of California-San Francisco, San Francisco, California. Electronic address: meyeon.park@ucsf.edu.",University of California]US
2469,"Division of Nephrology, Department of Medicine, and the Kidney Research Institute, University of Washington, Seattle, Washington.",University of Washington]US
2470,"Center for Transplantation Sciences, Massachusetts General Hospital, Boston, Massachusetts, USA.",Harvard University]US
2471,"Department of Medicine, Massachusetts General Hospital, Boston, Massachusetts, USA.",Harvard University]US
2473,"Department of Pathology, Massachusetts General Hospital and Harvard Medical School, Boston, Massachusetts.",Harvard University]US
2474,"Department of Epidemiology and Biostatistics, Drexel University School of Public Health, Philadelphia, Pennsylvania",Drexel University]US
2475,"Department of Health Policy and Management, Harvard T.H. Chan School of Public Health, Boston, MA.",Harvard University]US
2477,"Department of Pathology, Stanford University School of Medicine, Palo Alto, California, USA.",Stanford University]US
2485,"Division of Transplantation, Department of Surgery, University of Pittsburgh Medical Center, Pittsburgh, PA.",University of Pittsburgh]US
2489,"Division of Nephrology, Department of Medicine, Mailman School of Public Health, Vagelos College of Physicians and Surgeons and Department of Epidemiology, Columbia University, New York, New York.",Columbia University]US
2492,"Department of Pharmacy, University of Colorado Health, Aurora, Colorado, USA.",University of Colorado]US
2494,"Biostatistical Consulting Inc., Lexington, Massachusetts.",Biostatistical Consulting Inc]US
2495,"Department of Medicine, University of California, San Francisco, California, USA",University of California]US
2496,"Center for Individualized Medicine, Mayo Clinic, Rochester, Minnesota.",Mayo Clinic]US
2501,"Division of Nephrology, Department of Medicine, University of Tennessee Health Science Center, Memphis, Tennessee.",University of Tennessee]US
2502,"Department of Epidemiology, Rollins School of Public Health, Emory University, Atlanta, Georgia.",Emory University]US
2503,"Division of Nephrology, Department of Pediatrics, University of Michigan, Ann Arbor, Michigan.",University of Michigan]US
2507,"Washington University in St Louis, St. Louis, Missouri, USA.",Washington University in St. Louis]US
2510,"Fairbanks School of Public Health, Indiana University, Indianapolis, Indiana.",Indiana University]US
2513,"Institute for Clinical Research and Health Policy Studies, Tufts Medical Center, Boston, MA.",Tufts University]US
2515,"Department of Nephrology and Transplantation, Weill Cornell College of Medicine, New York, New York.",Cornell University]US
2516,"Mid-Carolinas Transplant Center, Medical University of South Carolina, Lancaster, South Carolina, USA.",University of South Carolina]US
