,Unnamed: 0,PARENT
813,"Department of Medical Ethics & Health Policy, Perelman School of Medicine, University of Pennsylvania, Philadelphia, Pennsylvania, USA.",University of Pennsylvania]US
815,"Division of Pulmonary, Critical Care and Sleep Medicine, Department of Medicine, University of Washington, Seattle, Washington",University of Washington]US
816,"Department of Biostatistics, Epidemiology and Informatics, Perelman School of Medicine, University of Pennsylvania, Philadelphia, Pennsylvania. Electronic address: amarals@chop.edu.",University of Pennsylvania]US
817,"Kaiser Permanente Northern California, Oakland, California.",Kaiser Permanente]US
818,"Division of Pulmonary and Critical Care Medicine, Department of Medicine, Washington University, St. Louis, Missouri, USA.",Washington University in St. Louis]US
820,"Oregon Health and Science University, Portland, Oregon.",Oregon Health and Science University]US
823,"NAD+ Immunology Laboratory, Huntington Medical Research Institutes, Pasadena, California, USA.",Huntington Medical]US
825,"Division of Infectious Diseases and International Medicine, University of Minnesota, Minneapolis, Minnesota, USA.",University of Minnesota]US
826,"David Geffen School of Medicine, University of California Los Angeles, Los Angeles, California, USA.",University of California]US
827,"Division of Nephrology and Infectious Diseases, AZ Sint-Jan Brugge, Brugge, Belgium.",AZ Sint-Jan]BE
832,"Division of Nephrology-Hypertension, University of California at San Diego, San Diego",University of California]US
833,"Department of Internal Medicine, Division of Nephrology, Bone and Mineral Metabolism, University of Kentucky, Lexington, KY.",University of Kentucky]US
834,"Department of Medicine, University of California, San Francisco, CA.",University of California]US
835,"Yale Center for Mendelian Genomics (YCMG), New Haven, Connecticut.",Yale University]US
837,"Center for Transplantation Sciences, Massachusetts General Hospital, Harvard Medical School, Boston, Massachusetts, USA",Harvard University]US
838,"Division of Transplant Surgery, University of California San Francisco, San Francisco, CA.",University of California]US
839,"Welch Center for Prevention, Epidemiology, and Clinical Research, Johns Hopkins University, Baltimore, Maryland",Johns Hopkins University]US
842,"Department of Internal Medicine, Division of Nephrology and Hypertension, Mayo Clinic, Rochester, Minnesota, USA.",Mayo Clinic]US
847,"Tonix Pharmaceuticals, Inc, Chatham, New Jersey, USA.",Tonix Inc]US
848,"Department of Medicine, Baylor University Medical Center, Dallas, Texas.",Baylor University]US
850,"Division of Nephrology, Bone, and Mineral Metabolism, Department of Internal Medicine, University of Kentucky, Lexington, Kentucky.",University of Kentucky]US
853,"Division of Nephrology-Hypertension, University of California at San Diego, San Diego.",University of California]US
856,"US Renal Care, Plano, Texas.",US Renal Care]US
858,"Bureau of Epidemiology, Pennsylvania Department of Health. Electronic address: shamcginni@pa.gov.",Pennsylvania Department of Health]US
863,"Department of Surgery,David Geffen School of Medicine,University of California,Los Angeles,Los Angeles,California,USA.",University of California]US
864,"Departments of Medicine (Nephrology), and Epidemiology and Population Health, Stanford University, Stanford, California.",Stanford University]US
868,"HLA Tissue Typing Laboratory, Brigham and Women's Hospital and Children's Hospital, Harvard Medical School, Boston, Massachusetts.",Harvard University]US
870,"Department of Cardiovascular Diseases, Mayo Clinic, Rochester, MN.",Mayo Clinic]US
872,"National Association of Nephrology Technicians/Technologists, Dayton, Ohio.",National Association of Nephrology Technicians]US
873,"Division of Transplantation, Department of Surgery, University of Wisconsin - Madison, Madison, WI.",University of Wisconsin]US
884,"Department of Pharmacy, UNC Medical Center, University of North Carolina at Chapel Hill, Chapel Hill, North Carolina",University of North Carolina]US
889,"Department of Medicine, Division of Nephrology, Columbia University Vagelos College of Physicians and Surgeons, New York, NY.",Columbia University]US
892,"Connecticut Emerging Infections Program, Yale School of Public Health, New Haven, Connecticut.",Yale University]US
895,"Division of Nephrology, Department of Medicine, Stanford University School of Medicine, Palo Alto, California.",Stanford University]US
896,"Nephrology Section, Veterans Affairs San Diego Healthcare System, San Diego, CA.",VA Health Systems Research]US
899,"Liver Transplant Unit, Intermountain Primary Children's Hospital and the Center for Global Surgery, University of Utah, Salt Lake City, UT.",Intermountain Health Inc]US
901,"Center for Health Information Partnership, Institute for Public Health and Medicine, Division of Internal Medicine, Feinberg School of Medicine, Northwestern University, Chicago, Illinois.",Northwestern Univerisity]US
903,"Department of Biomedical Engineering, University of Florida, Gainesville, Florida.",University of Florida]US
905,"Center for Spatial Data Science, University of Chicago, Chicago, Illinois.",University of Chicago]US
908,"Department of Quantitative Health Sciences, Clinical Trials, and Biostatistics, Mayo Clinic, Rochester, Minnesota.",Mayo Clinic]US
909,"Division of Transplantation, Department of Surgery, Penn Transplant Institute, University of Pennsylvania, Pennsylvania, Philadelphia, USA.",University of Pennsylvania]US
911,"Department of Medicine, Division of Nephrology, University of Maryland School of Medicine, Baltimore, Maryland.",University of Maryland]US
912,"Welch Center for Prevention, Epidemiology, and Clinical Research, Johns Hopkins University, Baltimore, Maryland. Electronic address: jishiga1@jhu.edu.",Johns Hopkins University]US
914,"Department of Epidemiology, School of Public Health and Tropical Medicine, Tulane University New Orleans, Louisiana.",Tulane University]US
917,"Department of Medicine, Division of Nephrology, Cedars-Sinai Medical Center, Los Angeles, California, USA.",University of California]US
919,"Department of Medicine, Section of Rheumatology, University of Chicago, Chicago, Illinois, USA",University of Chicago]US
920,"Department of Medicine, School of Medicine, University of Maryland, Baltimore, Maryland",University of Maryland]US
921,"Department of Internal Medicine, Ohio State University Medical Center, Columbus, Ohio, USA.",Ohio State University]US
923,"Department of Biostatistics and Bioinformatics, Rollins School of Public Health, Emory University, Atlanta, Georgia.",Emory University]US
926,"Keck Medicine of University of Southern California, Los Angeles, California, USA.",University of Southern California]US
927,"Division of Pediatric Nephrology, Children's Mercy Hospital, Kansas City, Missouri.",University of Kansas]US
930,"Division of Pulmonary and Critical Care, University of Maryland School of Medicine, Baltimore, Maryland, USA.",University of Maryland]US
933,"Departments of Medicine, Icahn School of Medicine at Mount Sinai and Recanati Miller Transplant Institute, Mount Sinai Hospital, New York, New York.",Mount Sinai]US
938,"Division of Nephrology, Department of Medicine, Kidney Research Institute, University of Washington, Seattle, Washington.",University of Washington]US
940,"Department of Surgery, New York University Grossman School of Medicine, New York, New York, USA",New York University]US
941,"Louis Stokes Cleveland VA Medical Center, Cleveland, Ohio.",VA Health Systems Research]US
943,"Veterans Affairs Connecticut Healthcare System, New Haven, Connecticut.",VA Health Systems Research]US
945,"Department of Rheumatology, Vanderbilt University Medical Center, Nashville, Tennessee.",Vanderbilt University]US
946,"Lincoln Nephrology & Hypertension, Lincoln, Nebraska.",Lincoln Nephrology]US
947,"Duke University Medical Center, Durham, North Carolina.",Duke University]US
948,"Division of Nephrology, Boston Children's Hospital, Harvard Medical School, Boston, Massachusetts.",Harvard University]US
951,"Department of Medicine, University of California, San Francisco, San Francisco, California.",University of California]US
953,"Center for Clinical Epidemiology and Biostatistics, University of Pennsylvania, Philadelphia, Pennsylvania.",University of Pennsylvania]US
954,"Department of Surgery, Division of Transplant and Hepatobiliary Surgery, University of California San Diego, San Diego, California, USA. Electronic address: abrubaker@health.ucsd.edu.",University of California]US
955,"Department of Medicine, Division of Nephrology, Wexner Medical, The Ohio State University, Columbus, Ohio.",Ohio State University]US
959,"Sawtooth Epidemiology and Infectious Diseases, Boise, Idaho.",Sawtooth Epidemiology Inc]US
960,"Division of Abdominal Transplant Surgery, Department of Surgery, Rutgers New Jersey Medical School, Newark, NJ.",Rutgers]US
961,"Department of Epidemiology and Biostatistics, University of California San Francisco, San Francisco, CA. Electronic address: elaine.ku@ucsf.edu.",University of California]US
962,"Nephrology Division, New York Grossman School of Medicine, NYU Langone Health, New York, New York.",New York University]US
963,"Division of Epidemiology, Department of Medicine, Vanderbilt University Medical Center, Nashville, Tennessee.",Vanderbilt University]US
964,"Department of Abdominal Transplantation, Stanford University Medical Center, Palo Alto, CA.",Stanford University]US
969,"Department of Pediatrics, Division of Nephrology, Stanford University School of Medicine, Palo Alto, California, USA",Stanford University]US
972,"Hines Veterans Health Administration, Chicago, Illinois.",VA Health Systems Research]US
975,"Yale School of Medicine, Department of Surgery, New Haven, Connecticut, USA.",Yale University]US
979,"Department of Pediatrics, Harvard Medical School, Boston, Massachusetts, USA.",Harvard University]US
985,"Institute for Clinical and Translational Research, School of Nursing, University of Wisconsin Madison, Madison, Wisconsin.",University of Wisconsin]US
987,"Department of Information and Outreach, American Society of Nephrology, Washington, DC.",American Society of Nephrology]US
988,"DaVita Kidney Care Inc, Denver, Colorado.",DaVita Inc]US
991,"Division of Pediatric Nephrology, Department of Pediatrics, Texas Children's Hospital/Baylor College of Medicine, Houston, Texas. Electronic address: mmichael@bcm.edu.",Baylor College of Medicine]US
992,"Division of Nephrology and Hypertension , Mayo Clinic , Jacksonville, Florida.",Mayo Clinic]US
993,"Department of Surgery, Mayo Clinic, Rochester, Minnesota, USA.",Mayo Clinic]US
994,"Division Pediatric Nephrology, Children's Hospital of Philadelphia, Philadelphia, Pennsylvania.",University of Pennsylvania]US
996,"Department of Physiology and Biochemical Engineering Robert and Arlene Kogod Center on Aging, Mayo Clinic, Rochester, Minnesota, USA.",Mayo Clinic]US
997,"Section of Nephrology and Clinical and Translational Research Accelerator, Department of Internal Medicine, School of Medicine, Yale University, New Haven, Connecticut.",Yale University]US
1000,"Department of Medicine, University of Illinois at Chicago, Chicago, Illinois.",University of Illinois]US
1006,"Division of Nephrology, University of Virginia School of Medicine, Charlottsville, Virginia.",University of Virginia]US
1009,"Division of Nephrology and Hypertension, Department of Medicine, Stony Brook University, Stony Brook, New York.",State University of New York]US
1014,"Department of Pediatrics, Weill Cornell Medicine and New York-Presbyterian Hospital, New York, New York. Electronic address: oma9005@med.cornell.edu.",Cornell University]US
1015,"Duke University Clinical Microbiology Laboratory, Durham, North Carolina, USA.",Duke University]US
1016,"Department of Epidemiology, Columbia University Mailman School of Public Health, New York, NY",Columbia University]US
1017,"Maze Therapeutics, South San Francisco, California.",Maze Inc]US
1018,"Department of Medicine, University of California San Francisco and the Priscilla Chan and Mark Zuckerberg San Francisco General Hospital, San Francisco, California.",University of California]US
1020,"Geriatric Research and Education Clinical Center, VA Palo Alto Health Care Systems, Palo Alto, California.",VA Health Systems Research]US
1023,"Critical Path Institute, Tucson, Arizona, USA.",Critical Path Institute]US
1028,"Departments of Medicine, of Epidemiology and Population Health, of Biomedical Data Science, and of Statistics and Meta-Research Innovation Center at Stanford (METRICS), Stanford University, Stanford, California.",Stanford University]US
1033,"Laboratory of Pathology, Center for Cancer Research, National Cancer Institute, National Institutes of Health, Bethesda, Maryland, USA.",National Institutes of Health]US
1035,"Computational Medicine Program, University of North Carolina at Chapel Hill, Chapel Hill, North Carolina, USA.",University of North Carolina]US
1037,"Quantitative Health Sciences, Mayo Clinic, Scottsdale, AZ.",Mayo Clinic]US
1038,"Division of Biomedical Statistics and Informatics, Mayo Clinic, Rochester, Minnesota.",Mayo Clinic]US
1040,"Department of Dermatology, University of California Davis School of Medicine, Sacramento, California, USA",University of California]US
1042,"University of Alabama at Birmingham, Birmingham, Alabama, USA.",University of Alabama]US
1045,"Department of Medicine, University of Mississippi Medical Center, Jackson, Mississippi.",University of Mississippi]US
1047,"Department of Surgery, Emory University, Atlanta, Georgia.",Emory University]US
1048,"Division of Pulmonary, Critical Care and Sleep Medicine, Department of Medicine, University of Washington, Seattle, Washington.",University of Washington]US
1050,"Departments of Biomedical Informatics, Biostatistics, and Medicine, Vanderbilt University Medical Center, Nashville, Tennessee.",Vanderbilt University]US
1053,"Department of Biostatistics, University of Iowa College of Public Health, Iowa City, Iowa, USA.",University of Iowa]US
1057,"Comprehensive Transplant Center, Northwestern University, USA.",Northwestern Univerisity]US
1059,"Oregon Clinical & Translational Research Institute, Oregon Health & Science University, Portland, Oregon.",Oregon Health and Science University]US
1060,"REACH/Dialysis Clinic, Inc., Nashville, Tennessee.","REACH/Dialysis Clinic, Inc.]US"
1063,"Department of Surgery, Baystate Medical Center Springfield, Massachusetts, Massachusetts, USA.",Baystate Health]US
1064,"Department of Epidemiology, Johns Hopkins Bloomberg School of Public Health, Johns Hopkins University School of Medicine, Baltimore, Maryland.",Johns Hopkins University]US
1065,"Virginia Commonwealth University, Richmond, Virginia.",Virginia Commonwealth University]US
1066,"Center of Innovation to Accelerate Discovery and Practice Transformation, Durham Veterans Affairs Medical Center, Durham, North Carolina.",VA Health Systems Research]US
1070,"Division of Transplantation, Department of Surgery, University of Wisconsin Madison, Madison, Wisconsin. Electronic address: cthiessen@wisc.edu.",University of Wisconsin]US
1071,"Division of Transplantation, Department of Surgery, Emory University School of Medicine, Atlanta, Georgia, USA",Emory University]US
1076,"Department of Medical Social Sciences, Northwestern University, Chicago, Illinois.",Northwestern Univerisity]US
1077,"Department of Biostatistics, Epidemiology, and Informatics, University of Pennsylvania, Philadelphia, Pennsylvania.",University of Pennsylvania]US
1078,"Division of Hematology-Oncology, Tufts Medical Center, Boston, Massachusetts.",Tufts University]US
1082,"Department of Biomedical Informatics, University of Pittsburgh, Pittsburgh, Pennsylvania.",University of Pittsburgh]US
1083,"Center for Kidney Health Research, Departments of Population Health Sciences and Nephrology, Geisinger, Danville, Pennsylvania. Electronic address: achang@geisinger.edu.",Geisinger Health]US
1084,"Department of Physiology and Biochemical Engineering Robert and Arlene Kogod Center on Aging, Mayo Clinic, Rochester, Minnesota, USA",Mayo Clinic]US
1088,"University of Rochester School of Medicine and Dentistry, Rochester, New York.",University of Rochester]US
1093,"Department of Medicine, NYU Grossman School of Medicine, New York, NY.",New York University]US
1096,"Department of Medicine, Division of Nephrology, University of California San Francisco, San Francisco, CA",University of California]US
1106,"Department of Nursing, University of Alabama Huntsville, Huntsville, AL, USA.",University of Alabama]US
1109,"Department of Population Health Sciences, School of Medicine, Duke University, Durham, North Carolina",Duke University]US
1110,"Harvard Medical School, Boston, Massachusetts, USA.",Harvard University]US
1111,"Department of Internal Medicine, Division of Biomedical Informatics, University of Kentucky, Lexington, KY",University of Kentucky]US
1112,"Department of Biostatistics, Epidemiology and Informatics, Perelman School of Medicine, University of Pennsylvania, Philadelphia, PA.",University of Pennsylvania]US
1116,"William B. Schwartz Division of Nephrology, Tufts Medical Center, Boston, Massachusetts.",Tufts University]US
1123,"William J. von Lie to the big Center for Transplantation and Clinical Regeneration, Mayo Clinic, Rochester, MN.",Mayo Clinic]US
1126,"Kidney Research Institute, University of Washington, Seattle, Washington.",University of Washington]US
1129,"Division of Infectious Diseases, University of Alabama at Birmingham, Birmingham, Alabama, USA.",University of Alabama]US
1132,"University Hospitals Cleveland Medical Center, Case Western Reserve University, Cleveland, Ohio",Case Western Reserve University]US
1133,"Center for Transplantation Sciences, Massachusetts General Hospital, Boston, Massachusetts, USA",Harvard University]US
1136,"Division of Hematology, Oncology, and Palliative Care, Department of Medicine, University of Wisconsin Madison, Madison, Wisconsin.",University of Wisconsin]US
1137,"Department of Epidemiology, Tulane University, New Orleans, Louisiana.",Tulane University]US
1139,"Duke Clinical Research Institute, Durham, North Carolina.",Duke University]US
1141,"Division of Nephrology-Hypertension, University of California-San Diego, San Diego, California",University of California]US
1142,"Smidt Heart Institute, Cedars-Sinai Medical Center, Beverly Hills, California, USA.",University of California]US
1143,"Johns Hopkins Immunogenetics Laboratory, Baltimore, Maryland, USA.",Johns Hopkins University]US
1144,"Transplant Infectious Disease Program and Transplant Center, Massachusetts General Hospital, Harvard Medical School, Boston, Massachusetts, USA.",Harvard University]US
1147,"Division of Nephrology and Hypertension, School of Medicine, Wayne State University, Detroit, MI.",Wayne State University]US
1156,"Department of Biomedical Informatics, Columbia University Irving Medical Center, New York, New York",Columbia University]US
1157,"Welch Center for Prevention, Epidemiology, and Clinical Research, Johns Hopkins University, Johns Hopkins University School of Medicine, Baltimore, Maryland",Johns Hopkins University]US
1159,"Department of Pharmacy and Therapeutics, University of Pittsburgh School of Pharmacy, Pittsburgh, Pennsylvania",University of Pittsburgh]US
1160,"Department of Clinical Pharmacy, University of California, San Francisco, CA.",University of California]US
1163,"Division of Hospital Medicine, University of California, Davis, Sacramento. Electronic address: sbascher@ucdavis.edu.",University of California]US
1164,"Division of Endocrinology, Diabetes, Metabolism, and Nutrition, Department of Medicine, Mayo Clinic, Rochester, Minnesota, USA.",Mayo Clinic]US
1166,"Weill Cornell Medicine - New York Presbyterian Hospital, New York, New York, USA.",Cornell University]US
1167,"Division of Abdominal Transplant Surgery, Department of Surgery, School of Medicine, Duke University, Durham, NC.",Duke University]US
1168,"Division of Abdominal Organ Transplantation and Hepato-Biliary and Pancreatic Surgery, Keck School of Medicine, University of Southern California, Los Angeles, California, USA.",University of Southern California]US
1170,"Division of General Internal Medicine, School of Medicine, Duke University, Durham, North Carolina.",Duke University]US
1171,"Department of Medicine, School of Medicine, University of Maryland, Baltimore, Maryland.",University of Maryland]US
1172,Colorado Department of Public Health & Environment.,Colorado Department of Public Health & Environment]US
1176,"Division of Cardiovascular Medicine, Vanderbilt University Medical Center, Nashville, Tennessee, USA",Vanderbilt University]US
1178,"Department of Medicine, Duke University Medical Center, Durham, North Carolina.",Duke University]US
1179,"Pathology & Cell Biology, Columbia University Irving Medical Center, New York, USA.",Columbia University]US
1180,"Department of Pediatrics, Division of Nephrology, University of Michigan, Ann Arbor, MI, 48104, USA.",University of Michigan]US
1181,"Department of Plastic and Reconstructive Surgery, Johns Hopkins University School of Medicine, Baltimore, Maryland, USA.",Johns Hopkins University]US
1182,"Division of Kidney, Urologic, and Hematologic Diseases, National Institute of Diabetes and Digestive and Kidney Diseases, National Institutes of Health, Bethesda, Maryland.",National Institutes of Health]US
1183,"Department of Surgery, University of Maryland, Baltimore, Maryland.",University of Maryland]US
1184,"Division of Nephrology, Tufts Medical Center, Tufts University School of Medicine, Boston, Massachusetts. Electronic address: rperrone@tuftsmedicalcenter.org.",Tufts University]US
1187,"Department of Quantitative Health Sciences, Cleveland Clinic, Cleveland, Ohio.",Case Western Reserve University]US
1188,"Renal-Electrolyte Division, Department of Medicine, University of Pittsburgh School of Medicine, Pittsburgh, Pennsylvania.",University of Pittsburgh]US
1189,"Division of Nephrology, Rush University Medical Center, Chicago, Illinois.",Rush University]US
1190,"Department of Medicine, Division of Nephrology, Tufts University, Boston, Massachusetts.",Tufts University]US
1192,"Division of Nephrology, University of Illinois at Chicago, Chicago, Illinois.",University of Illinois]US
1195,"Mouse Behavior Core, Department of Genetics, Harvard Medical School, Boston, Massachusetts, USA.",Harvard University]US
1196,"Department of Transplant,Mayo Clinic Florida,Jacksonville,Florida,USA. Electronic address: croome.kristopher@mayo.edu.",Mayo Clinic]US
1198,"Division of Research, Kaiser Permanente Northern California, Oakland, California",Kaiser Permanente]US
1199,"Department of Pediatrics and Medicine, University of Minnesota, Minneapolis, Massachusetts.",University of Minnesota]US
1200,"Division of High-Consequence Pathogens and Pathology, National Center for Emerging and Zoonotic Infectious Diseases, Centers for Disease Control and Prevention, Atlanta, Georgia, USA.",CDC]US
1201,"Cardiology Division, Massachusetts General Hospital and Harvard Medical School, Boston, Massachusetts.",Harvard University]US
1206,"Department of Surgery/Transplant, Yale University School of Medicine, New Haven, CT.",Yale University]US
1207,"Center for Precision Medicine and Genomics, Department of Medicine, Columbia University, New York City, New York, USA.",Columbia University]US
1208,"Division of Pulmonary, Allergy and Critical Care Medicine, University of Pennsylvania, Philadelphia, Pennsylvania, USA.",University of Pennsylvania]US
1210,"School of Medicine, University of Colorado, Aurora, Colorado.",University of Colorado]US
1211,"Department of Medicine, Stanford Center for Clinical Research, Palo Alto, CA.",Stanford University]US
1212,"Department of Surgery, Johns Hopkins University School of Medicine, Baltimore, Maryland, USA.",Johns Hopkins University]US
1213,"Department of Plastic and Reconstructive Surgery, Morsani College of Medicine, University of South Florida, Tampa, Florida, USA.",University of South Florida]US
1220,"Veterans Affairs Health Services Research and Development Center for Innovations in Quality, Effectiveness and Safety, Houston, Texas.",VA Health Systems Research]US
1222,"Public Health Division, Oregon Health Authority.",Oregon Health Authority]US
1223,"Division of Infectious Diseases, University of California, San Francisco, California, USA.",University of California]US
1224,"Valley Children's Healthcare, Madera, California.",Stanford University]US
1226,"Division of Renal Diseases and Hypertension, George Washington University, Washington, DC.",George Washington University]US
1227,"Section of Cardiovascular Research, Department of Medicine, Baylor College of Medicine, Houston, Texas",Baylor College of Medicine]US
1228,"Department of Surgery, Thomas E. Starzl Transplantation Institute, University of Pittsburgh, Pittsburgh, Pennsylvania.",University of Pittsburgh]US
1233,"University of Maryland Medical Center, Baltimore, Maryland, USA. Electronic address: mary.lin@som.umaryland.edu.",University of Maryland]US
1235,"Geriatric Research and Education Clinical Center, Palo Alto VA Health Care System, Palo Alto, California.",VA Health Systems Research]US
1238,"Brown and Toland, Oakland, California.",Brown and Toland]US
1239,"Department of Pediatrics, School of Medicine, Emory University, Atlanta, Georgia",Emory University]US
1241,"Department of Radiology, Mayo Clinic, Rochester, Minnesota.",Mayo Clinic]US
1245,"Department of Population Health, New York University Grossman School of Medicine, New York, New York, USA.",New York University]US
1246,"Division of Nephrology, Department of Medicine, University of Wisconsin School of Medicine and Public Health, Madison, Wisconsin, USA. Electronic address: blm@medicine.wisc.edu.",University of Wisconsin]US
